comment_id,vendor_id,comment_text,vendor_code,foods
45138133,79514,عالی,p47x4r,"{'product_title': 'زرشک پلوبامرغ', 'product_description': 'یک پرس برنج وران مرغ', 'product_id': 9629544}"
46039500,79514,افتضاحترین حلیمی که میشد بخورم,p47x4r,"{'product_title': 'حلیم مخصوص 1کیلو', 'product_description': 'حلیم باگندم وگوشت تازه 1کیلوباظرف ماکروویو', 'product_id': 18864558}"
46010407,79514,نان کم بود نسبت به ۱.۵ حلیم ( دو کف دست نان بود),p47x4r,"{'product_title': 'حلیم مخصوص 1/5کیلو', 'product_description': 'حلیم باگندم وگوشت تازه باظرف ماکروویو', 'product_id': 18864581}"
45780898,79514,خوب بود خیلی متفاوت بود,p47x4r,"{'product_title': 'حلیم مخصوص 1کیلو', 'product_description': 'حلیم باگندم وگوشت تازه 1کیلوباظرف ماکروویو', 'product_id': 18864558}"
45352180,79514,مثل همیشه عالی خداقوت,p47x4r,"{'product_title': 'حلیم مخصوص ۵۰۰گرم', 'product_description': 'حلیم باگندم وگوشت تازه 1کیلوباظرف ماکروویو', 'product_id': 19009247}"
45352180,79514,مثل همیشه عالی خداقوت,p47x4r,"{'product_title': 'نوشابه قوطی میرندا پرتقالی', 'product_description': '330 میلی لیتر', 'product_id': 8243060}"
30636901,79514,"برنج دون بود. تاخیر هم داشت.
توی صفحه رستوران نوشته تحویل تا ۴۵ دقیقه. اما در عمل خیلی بیشتر از اینه.",p47x4r,"{'product_title': 'چلوگوشت', 'product_description': '250گرم گوشت و یک پرس برنج', 'product_id': 9725616}"
18830898,79514,عالی فقط ای کاش ساعت کاریتون زمانش بیشتربود,p47x4r,"{'product_title': 'خوراک کباب لقمه', 'product_description': '2 سیخ کباب کوبیده210 گرمی با گوشت مخلوط گوساله و گوسفندی', 'product_id': 8243144}"
