comment_id,comment_text,foods
42454956.0,غذا شدیدا سرد به دستم رسید,"[{'title': 'چلو خورشت قرمه سبزی'}, {'title': 'نوشابه بطری پپسی'}]"
49129239.0,"سلام..کیفیت معمولی روی به پایین است و جا دارد خیلی روی کیفیت کار شود و برنج هم بسیار معمولی و البته به اندازه یک نفر هم کفاف نمی کرد حالت پرس بچه گانه داشت..کباب هم کیفیت پایین و بسیار حجم کوچکی داشت و جوجه هم کیفیت معمولی داشت و جا داشت پخت تر شود...
موفق باشید","[{'title': 'چلو کباب وزیری'}, {'title': 'خوراک کباب کوبیده نگین دار'}]"
49331025.0,متاسفانه ۲ بسته از بسته های غذا کاملا شکسته بود و محتوی بسته ها بیرون ریخته بود,[{'title': 'خورشت قرمه سبزی (اضافه)'}]
48150724.0,پاچین زده بود ۴۵۰ گرمی ولی تحویل با ظرفش ۳۰۰ گرم بود,"[{'title': 'خورشت قیمه سیب زمینی (اضافه)'}, {'title': 'خورشت قرمه سبزی (اضافه)'}, {'title': 'خوراک پاچین کبابی'}]"
49878490.0,خوشمزه بود ولی خیلییییی چرب بود و روغن ریخته بود توی پلاستیک.از روغن غذا کم کنید لطفا.هردوغذا چرب بود,"[{'title': 'چلو مرغ سس پز ران'}, {'title': 'چلو مرغ سرخ شده ران'}]"
49882833.0,عالی و خوشمزه بود ممنونم,"[{'title': 'شله ممتاز یک کیلوگرم'}, {'title': 'شله ممتاز 500 گرم'}]"
49750535.0,من کلا کوبیده دوست دارم هرچی باشه میخورم ولی این کباب یه بویی میداد اصلا خوشم نیومد دیگه سفارش نمیدم,"[{'title': 'خوراک کباب کوبیده یک سیخ'}, {'title': 'گوجه کبابی (اضافه)'}, {'title': 'خوراک کباب کوبیده یک سیخ'}]"
46040093.0,مقدار و کیفیت عالی,[{'title': 'استامبولی'}]
46147135.0,از همه لحاظ راضی بودم,"[{'title': 'چلو جوجه کباب یک سیخ'}, {'title': 'چلو کباب وزیری'}, {'title': 'دوغ شیشه ای آبعلی'}]"
48467017.0,قرمه سبزی اصلا خوب نبود این دفعه,"[{'title': 'چلو خورشت قرمه سبزی'}, {'title': 'نوشابه بطری پپسی'}]"
49717536.0,بسیار بسیار عالی و خوشمزه,[{'title': 'شله ممتاز یک کیلوگرم'}]
46923008.0,مرغ طعمو مزه نداشت,"[{'title': 'چلو مرغ سرخ شده مخصوص'}, {'title': 'چلو کره'}, {'title': 'سوپ جو یک نفره'}, {'title': 'نوشابه خانواده پپسی'}]"
46285923.0,کیفیت کباب متوسط بود نپسندیدم,"[{'title': 'چلو کباب کوبیده معمولی یک سیخ'}, {'title': 'گوجه کبابی (اضافه)'}, {'title': 'لیموناد خانواده زمزم'}, {'title': 'چلو کباب لقمه'}]"
47501510.0,همه چی عالی بود,"[{'title': 'چلو کباب نگینی'}, {'title': 'پک قاشق و چنگال'}, {'title': 'چلو خورشت قرمه سبزی'}]"
47026276.0,بسیار عالی و خوشمزه بود,"[{'title': 'خوراک جوجه کباب یک سیخ'}, {'title': 'خوراک کباب کوبیده یک سیخ'}]"
42134410.0,کیفیتش به شدت پایین بود,"[{'title': 'چلو کباب کوبیده دو سیخ'}, {'title': 'چلو جوجه کباب یک سیخ'}]"
47246492.0,ممنون از پیکتون خداییش ندیده بودم تا بحال مثل ایشون خوش‌ برخورد,"[{'title': 'چلو کره'}, {'title': 'چلو کباب کوبیده معمولی یک سیخ'}, {'title': 'نان لواش (اضافه)'}]"
41861951.0,لطفا از ظرف باکیفیت تری استفاده کنید تا در اثر گرما تغییر شکل نده,"[{'title': 'چلو خورشت قیمه سیب زمینی'}, {'title': 'چلو خورشت قرمه سبزی'}]"
44500164.0,خوراک مرغ با سس خوشمزه بود و جوجه هم خوب بود. ولی دفعه اولی که غذا رو تحویل دادن یادشون رفته بود نصف سفارش رو بفرستن و مجبور شدم به پشتیبان پیام بدم. البته مشکل حل شد و تقریبا نیم ساعت بعد بقیه غذا رو فرستادن ولی به هرحال همچین اشتباهی برام عجیب بود.,"[{'title': 'خوراک مرغ سس پز ران'}, {'title': 'خوراک جوجه کباب یک سیخ'}]"
45491523.0,اولین بار بود ک سفارش میدادم واقعا عالی بود غذا گرم، حجمش بالا بود و زود ب دستم رسید.شک ندارم دفعات بعد هم سفارش بدم.در کل بسیار عالی ممنونم,[{'title': 'استامبولی'}]
42550251.0,خیلی کیفیت عالی بود و زود رسید,[{'title': 'چلو کباب وزیری'}]
39176227.0,عالیه,[{'title': 'خوراک جوجه کباب یک سیخ'}]
39450407.0,"سلام ممنونم از مدیریت 
غذا باکیفیت و از همه مهمتر خییلی زودتر از زمان تعیین شده میرسه من مشتری ثابتم چندساله و راضیم غذا شور نیس سرد نیس همه چی اندازس نظرمو اینبار ثبت کردم که دوستان باخیالت راحت سفارش بدن 
باتشکر",[{'title': 'چلو کباب کوبیده  دو سیخ'}]
37291634.0,ممنون,"[{'title': 'چلو کباب کوبیده  دو سیخ'}, {'title': 'خوراک کباب لقمه'}, {'title': 'نوشابه بطری میرندا پرتقالی'}]"
42457287.0,وزیری خیلی خوب بود فقط یادتون رفت دوغ رو بزارید ولی پیک محترم رفت دوباره آورد خیلی خوش برخورد بود در کل عالی,"[{'title': 'چلو کباب وزیری'}, {'title': 'دوغ شیشه ای آبعلی'}]"
39080769.0,"کیفیت مناسب ولی اگر حجم و کمیت غذا با قیمت تناسب بیشتری داشت بهتر بود
بازم ممنون",[{'title': 'چلو جوجه کباب یک سیخ'}]
40391616.0,باتشکر از شما.,[{'title': 'خوراک کباب کوبیده یک سیخ'}]
42822391.0,خوب بود,[{'title': 'چلو خورشت قرمه سبزی'}]
40473956.0,"خیلیییی خوب بود واقعا 
خوشمزه و لذیذ",[{'title': 'چلو کباب کوبیده دو سیخ'}]
45806805.0,معمولی,[{'title': 'خوراک پاچین کبابی'}]
43776530.0,سریع آوردن,"[{'title': 'چلو کباب کوبیده یک سیخ'}, {'title': 'پک قاشق و چنگال'}]"
40475252.0,طعم کباب رو اصلا دوس نداشتم,[{'title': 'خوراک کباب کوبیده یک سیخ'}]
40592502.0,کیفیت متوسط بود,[{'title': 'چلو کباب کوبیده دو سیخ'}]
39046252.0,ممنون كبابش عالي بود,"[{'title': 'زیتون'}, {'title': 'چلو کباب کوبیده  یک سیخ'}]"
42343940.0,"رستوران سر کوچمون هست ولی نزدیک ۴۰ دقیق طول کشید تا برسه و چیزی که سفارش داده بودم ته‌دیگ و سوپ بود یعنی باید آماده باشه و نیازی به زمان آماده سازی نداره فقط باید ظرف کنن. 
ته دیگ که اصلا زعفرانی نبود خشک و یک لایه ماست و ... داشت شبیه ته دیگ برنج کته بود بیشتر . سوپ هم خیلی خیلی بی‌مزه بدون هیچ چاشنی و مزه‌ای صد رحمت به سوپ بیمارستان و سفتتتتت، پر از جو  چقدر آب ریختم هم زدم گرم کردم که قابل خوردن باشه.
نه یه ذره نمک نه آبلیمو و ... هییییچ","[{'title': 'ته دیگ پرسی'}, {'title': 'سوپ جو 500 گرم'}]"
35881555.0,"كباب كاملا پخته بود و طعم خوبي داشت
حجم و طعم برنجم خوب بود 
ممنون از شما",[{'title': 'چلو کباب سلطانی'}]
43687380.0,روغن قیمه خیلی زیاد بود سیب زمینی هم نداشت,"[{'title': 'چلو خورشت قیمه سیب زمینی'}, {'title': 'چلو خورشت قرمه سبزی'}]"
44971910.0,به برنج ایرانی نمیخورد,[{'title': 'چلو کباب وزیری'}]
38180756.0,با سلام غذا زودتر از ساعت مشخص شده به دستم رسید همه چی خوب بود فقط کباب تند بود,"[{'title': 'چلو کباب وزیری'}, {'title': 'چلو کباب کوبیده  دو سیخ'}]"
42829571.0,حجم برنج کم هست,[{'title': 'چلو کباب وزیری'}]
42521231.0,کیفیت افتضاحححح,"[{'title': 'خورشت قرمه سبزی (اضافه)'}, {'title': 'خورشت قیمه سیب زمینی (اضافه)'}]"
42635207.0,خوب بود ممنون,"[{'title': 'خورشت قرمه سبزی (اضافه)'}, {'title': 'خورشت قیمه سیب زمینی (اضافه)'}, {'title': 'نوشابه بطری پپسی'}]"
45570246.0,"با سلام و خسته نباشید
متاسفانه کیفیت به شدت افت کرده 
معایب سفارش این بار:
برنج خام
قیمه بی مزه و شبیه پوره
جوجه‌ بدون هیچ عطر و طعم 
سوپ هم فقط جو و کمی هویج","[{'title': 'چلو جوجه کباب یک سیخ'}, {'title': 'سوپ جو  یک کیلوگرم'}, {'title': 'چلو خورشت قیمه سیب زمینی'}]"
42676497.0,سبزی قرمه سبزی رو خیلی تفت داده بودند,"[{'title': 'خورشت قرمه سبزی (اضافه)'}, {'title': 'نوشابه خانواده پپسی'}]"
42317864.0,پیک عالی,"[{'title': 'ته دیگ پرسی'}, {'title': 'خورشت قیمه سیب زمینی (اضافه)'}]"
36409194.0,جوجه و کوبیده خوب بود برگ.کمی خشک بود ولی در کل با کیفیت,"[{'title': 'چلو جوجه کباب یک سیخ'}, {'title': 'چلو کباب سلطانی'}]"
38248337.0,قیمه شون عالللییهههههه,[{'title': 'خورشت قیمه سیب زمینی (اضافه)'}]
40748743.0,"کیفیت نسبت به قیمت خوب بود
زمان ارسال هم بسیار عالی بود
فقط دلستر اشتباه فرستاده شده بود که اصلا استفاده نکردیم","[{'title': 'چلو خورشت قرمه سبزی'}, {'title': 'ماءالشعیر خانواده هی جو لیمو'}]"
42121156.0,کیفیت نسبتا خوب,"[{'title': 'چلو کباب کوبیده دو سیخ'}, {'title': 'چلو جوجه کباب یک سیخ'}, {'title': 'گوجه کبابی (اضافه)'}]"
36293121.0,مثل هميشه عالي,"[{'title': 'چلو کباب نگینی'}, {'title': 'چلو خورشت قرمه سبزی'}, {'title': 'نوشابه خانواده سون آپ'}]"
42635154.0,همه آیتم ها خوب بود. تشکر,[{'title': 'شله ممتاز یک کیلوگرم'}]
43261748.0,"اول از رفتار پیک محترم که با وجود نبودن آسانسور اومد بالا و غذا رو درب واحد تحویل داد تشکر میکنم.از کیفیت غذاهم راضی بودم ممنون.
دوم هم اینکه بجای سفارش من چلوکباب کوبیده آورده بودن و چون وقت ناهار گذشته بود و گرسنه بودم و شماره رستوران و پیک عزیز رو نداشتم نتونستم برگشت بزنم و لاجرم غذا رو استفاه کردم .حالاهم برای پرداخت مابه التفاوت قیمت غذاها درخدمت رستوران مربوطه و اسنپ فود هستم. سپاس","[{'title': 'خوراک جوجه کباب یک سیخ'}, {'title': 'نان لواش (اضافه)'}, {'title': 'نوشابه خانواده پپسی'}]"
41008200.0,غذا خیلی خوب بود و سریع رسید,"[{'title': 'چلو خورشت قرمه سبزی'}, {'title': 'دوغ خانواده خوشگوار'}]"
43808665.0,"سلام به عوامل رستوران، وضمن خسته نباشید به مدیریت،اشپز وکارکنان
بسته بندی خود غذا خوب بود ولی به علت این که دوسه پرس رو هم بود کمی محتویات داخل هر بسته از چشم نوازی خاص خودش کم شده بود، انتظار میره برسی وحل بشه
کیفیت کوبیده وقیمه خوب بود ،ولی ولی ولی کاملا مشخص بود سوپ از پایین ترین کیفیت برخورداربود که فقط دو سه قاشق خوردیم وبقیش تو سطل اشغال،
اگر از کوبیده وقیمه راضی بودم وهستم از سوپ بسیار ناراضی ام، به امید ارتقائ در کیفیت تمامی غذاها، مخصوصا سوپ","[{'title': 'چلو خورشت قیمه سیب زمینی'}, {'title': 'چلو کباب کوبیده دو سیخ'}, {'title': 'سوپ جو یک نفره'}]"
35026351.0,با عرض سلام غذا بد نبود من دوتا چلو گوشت سفارش داده بودم به حدی شور بود که تا صبح فقط اب خوردم و اینقدر برنجشون چرب کرده بودن و همچنین گوشت شون تو روغن زیاد بود,[{'title': 'چلو گوشت گوسفندی'}]
42224336.0,خوشمزه بود، ممنونم.,"[{'title': 'خوراک جوجه کباب یک سیخ'}, {'title': 'نوشابه بطری میرندا پرتقالی'}, {'title': 'نوشابه بطری پپسی'}]"
42046951.0,خوب بود,"[{'title': 'چلو خورشت قیمه سیب زمینی'}, {'title': 'چلو کره'}]"
42988716.0,عالی بود مثل همیشه,[{'title': 'چلو کباب وزیری'}]
42132997.0,,[{'title': 'چلو خورشت قیمه سیب زمینی'}]
44569709.0,عالی مثل همیشه,"[{'title': 'خوراک کباب کوبیده یک سیخ'}, {'title': 'نان لواش (اضافه)'}, {'title': 'خوراک پاچین کبابی'}, {'title': 'نان لواش (اضافه)'}]"
45350873.0,"نمک کم یا زیاد وقتی غذا با کیفیت باشه زیاد مهم نیست واقعا دمتون گرم سرعت و کیفیت عالی.
موفق باشید","[{'title': 'چلو کره'}, {'title': 'خوراک کباب کوبیده یک سیخ'}, {'title': 'نان لواش (اضافه)'}, {'title': 'گوجه کبابی (اضافه)'}, {'title': 'ماست ساده'}, {'title': 'نوشابه بطری پپسی'}]"
42639912.0,من چون گوشت نمی‌خورم استامبولی سفارش دادم چون توی توضیحاتش گوشت نزده بود ولی وقتی اومد دیدم گوشت چرخ کرده داره و نتونستم استفاده کنم لطفا توضیحات و درست بزنن,"[{'title': 'استامبولی'}, {'title': 'پک قاشق و چنگال'}, {'title': 'سوپ جو 500 گرم'}, {'title': 'نوشابه بطری میرندا پرتقالی'}]"
42627264.0,کیفیت غذا اصلا خوب نبود,"[{'title': 'شله ممتاز یک کیلوگرم'}, {'title': 'نوشابه بطری پپسی'}]"
35910723.0,عالی و منحصر بفرد,[{'title': 'خوراک جوجه کباب یک سیخ'}]
36736607.0,غذا با کیفیت،گرم و زود به دستم رسید.ممنون,[{'title': 'چلو کباب کوبیده دو سیخ'}]
40765025.0,"متاسفانه به تازگی طرفها در اثر گرمای غذا تغییر حالت می‌دهند
امیدوارم از ظرفهای استاندارد استفاده شود",[{'title': 'چلو کباب کوبیده دو سیخ'}]
43755833.0,خیلی دیدگاه های خوبی توی نظرات نبود ولی ما اعتماد کردیم سفارش دادیم خیلی سریع به دستمون رسید غذا گرم گرم بود حتی پیک تا بالا اومد در صورتی که تمامی پیک ها میان مجتمع جلوی نگهبانی زنگ میزنن بیاین بگیرین. مرغشون خوب بود دورچین و بسته بندی خوبی هم داشت اصلا بو نمیداد گوشتش قرمز نبود نمیدونم چرا اینقد دیدگاه بد متاسفانه براشون نوشته بودن,[{'title': 'خوراک مرغ سرخ شده ران'}]
42297171.0,خوب,"[{'title': 'چلو خورشت قیمه سیب زمینی'}, {'title': 'چلو کره'}]"
45447039.0,نسبتا خوب بود راضی بودم,[{'title': 'چلو کباب وزیری'}]
44569737.0,عالی بود مرسی لز شما,[{'title': 'خورشت قرمه سبزی (اضافه)'}]
